c_classid;c_instanceid;c_price;c_offers;c_popularity;c_rarity;c_quality;c_heroid;c_slot;c_market_name;c_name_color;c_pop
186150629;143865972;14800;66;1613;"базового класса";;21;Обыч.;"Ключ от кейса CS:GO";D2D2D2;1253
186150630;143865972;14900;35;260;"базового класса";;21;Обыч.;"Ключ eSports";D2D2D2;1300
191923205;143865972;13990;3;510;"базового класса";;3279;Обыч.;"Именной ярлык";D2D2D2;1134
259019412;143865972;15800;18;338;"базового класса";;21;Обыч.;"Ключ от кейса Winter Offensive";D2D2D2;1149
259019413;143865972;7299;259;879;"базового класса";;3111;Обыч.;"Коробка с подарком";D2D2D2;1059
259019414;143865972;190000;2;4;"базового класса";;3111;Обыч.;"Посылка для аудитории";D2D2D2;567
259019415;143865972;120503;2;2;"базового класса";;3111;Обыч.;"Груда подарков";D2D2D2;618
310776497;188530139;116500;5;94;Засекреченное;"Немного поношенное";47;Обыч.;"AWP | БАХ (Немного поношенное)";D2D2D2;1222
310776501;0;33999;2;24;Запрещенное;"Прямо с завода";47;Обыч.;"SCAR-20 | Изумруд (Прямо с завода)";D2D2D2;1000
310776502;0;223;3;105;Ширпотреб;"Немного поношенное";19;Обыч.;"Dual Berettas | Наемник (Немного поношенное)";D2D2D2;399
310776509;0;153;12;121;Ширпотреб;"Немного поношенное";47;Обыч.;"SCAR-20 | Песчаная сетка (Немного поношенное)";D2D2D2;510
310776512;0;474;11;285;"Промышленное качество";"Прямо с завода";3;Обыч.;"MAC-10 | Карамельное яблоко (Прямо с завода)";D2D2D2;941
310776521;188530139;24566;3;275;Запрещенное;"После полевых испытаний";19;Обыч.;"USP-S | Камуфляж (После полевых испытаний)";D2D2D2;936
310776522;188530139;2228;3;179;"Армейское качество";"После полевых испытаний";3;Обыч.;"ПП-19 Бизон | Синие полутона (После полевых испыта";D2D2D2;406
310776527;188530139;11998;2;232;"Армейское качество";"Немного поношенное";17;Обыч.;"M4A1-S | Кровавый тигр (Немного поношенное)";D2D2D2;660
310776528;188530139;36500;1;51;Запрещенное;"Немного поношенное";19;Обыч.;"USP-S | Камуфляж (Немного поношенное)";D2D2D2;1207
310776531;188530139;13002;9;138;Запрещенное;"Прямо с завода";17;Обыч.;"AK-47 | Синий ламинат (Прямо с завода)";D2D2D2;1167
310776535;0;2500;5;4;Ширпотреб;"После полевых испытаний";75;Обыч.;"M249 | Пиксельный камуфляж «Джунгли» (После полевы";D2D2D2;406
310776543;0;141;22;117;Ширпотреб;"После полевых испытаний";17;Обыч.;"Galil AR | Белое напыление (После полевых испытани";D2D2D2;546
310776543;302028390;100;28;1080;Ширпотреб;"После полевых испытаний";17;Обыч.;"Galil AR | Белое напыление (После полевых испытаний)";D2D2D2;770
310776545;0;500;4;12;Ширпотреб;"После полевых испытаний";3;Обыч.;"P90 | Ожоги (После полевых испытаний)";D2D2D2;908
310776546;188530139;5999;1;96;"Армейское качество";"Немного поношенное";19;Обыч.;"Five-SeveN | Ками (Немного поношенное)";D2D2D2;394
310776554;0;4900;1;3;Ширпотреб;"Прямо с завода";3;Обыч.;"ПП-19 Бизон | Городская штриховка (Прямо с завода)";D2D2D2;125
310776557;0;1861;1;72;Ширпотреб;Поношенное;19;Обыч.;"Dual Berettas | Колония (Поношенное)";D2D2D2;38
310776558;0;117;9;81;Ширпотреб;"После полевых испытаний";3;Обыч.;"ПП-19 Бизон | Песчаная штриховка (После полевых ис";D2D2D2;350
310776558;302028390;100;22;795;Ширпотреб;"После полевых испытаний";3;Обыч.;"ПП-19 Бизон | Песчаная штриховка (После полевых испытаний)";D2D2D2;720
310776560;0;167;31;1148;Ширпотреб;"После полевых испытаний";49;Обыч.;"Nova | Полярная сетка (После полевых испытаний)";D2D2D2;479
310776563;188530139;7688;7;143;Запрещенное;"Прямо с завода";3;Обыч.;"MP9 | Гипнотический (Прямо с завода)";D2D2D2;828
310776566;0;1416;29;3557;"Промышленное качество";"После полевых испытаний";47;Обыч.;"AWP | Африканская сетка (После полевых испытаний)";D2D2D2;586
310776567;0;500;3;89;Ширпотреб;"Немного поношенное";47;Обыч.;"G3SG1 | Полярный камуфляж (Немного поношенное)";D2D2D2;184
310776570;0;123;89;1666;Ширпотреб;"После полевых испытаний";19;Обыч.;"P250 | Северный лес (После полевых испытаний)";D2D2D2;610
310776571;0;7115;8;3;"Промышленное качество";"Прямо с завода";17;Обыч.;"AUG | Осужденный (Прямо с завода)";D2D2D2;1037
310776573;0;100;39;294;Ширпотреб;"После полевых испытаний";3;Обыч.;"MP9 | Песчаная штриховка (После полевых испытаний)";D2D2D2;570
310776577;0;196;5;29;Ширпотреб;"После полевых испытаний";3;Обыч.;"UMP-45 | Пиксельный камуфляж «Город» (После полевы";D2D2D2;423
310776577;302028390;100;37;341;Ширпотреб;"После полевых испытаний";3;Обыч.;"UMP-45 | Пиксельный камуфляж «Город» (После полевых испытаний)";D2D2D2;800
310776579;188530139;3598;6;171;"Армейское качество";"После полевых испытаний";17;Обыч.;"M4A4 | Тусклые полосы (После полевых испытаний)";D2D2D2;643
310776580;0;115;14;78;Ширпотреб;"После полевых испытаний";47;Обыч.;"G3SG1 | Тропическая штриховка (После полевых испыт";D2D2D2;496
310776580;302028390;100;19;641;Ширпотреб;"После полевых испытаний";47;Обыч.;"G3SG1 | Тропическая штриховка (После полевых испытаний)";D2D2D2;570
310776584;0;490;33;116;"Промышленное качество";"После полевых испытаний";17;Обыч.;"Galil AR | Смешанный камуфляж (После полевых испыт";D2D2D2;449
310776584;302028390;489;48;199;"Промышленное качество";"После полевых испытаний";17;Обыч.;"Galil AR | Смешанный камуфляж (После полевых испытаний)";D2D2D2;384
310776586;0;895;13;213;"Промышленное качество";"После полевых испытаний";49;Обыч.;"XM1014 | Вороненая сталь (После полевых испытаний)";D2D2D2;220
310776589;188530139;4500;2;189;"Армейское качество";"Немного поношенное";17;Обыч.;"FAMAS | Смертенок (Немного поношенное)";D2D2D2;609
310776590;0;167;27;1348;Ширпотреб;"После полевых испытаний";17;Обыч.;"AUG | Наемник (После полевых испытаний)";D2D2D2;413
310776593;0;318;12;76;"Промышленное качество";"Прямо с завода";3;Обыч.;"ПП-19 Бизон | Ночные операции (Прямо с завода)";D2D2D2;1000
310776595;0;100;105;282;Ширпотреб;"После полевых испытаний";47;Обыч.;"G3SG1 | Песчаная буря (После полевых испытаний)";D2D2D2;750
310776596;0;3355;7;0;"Промышленное качество";"Закаленное в боях";47;Обыч.;"SSG 08 | Тропическая гроза (Закаленное в боях)";D2D2D2;813
310776598;188530139;10800;12;6;"Армейское качество";"Немного поношенное";47;Обыч.;"G3SG1 | Витраж (Немного поношенное)";D2D2D2;384
310776601;0;4000;1;20;"Промышленное качество";"После полевых испытаний";19;Обыч.;"Glock-18 | Грунтовая вода (После полевых испытаний";D2D2D2;796
310776612;0;100;86;311;Ширпотреб;"После полевых испытаний";49;Обыч.;"Nova | Хищник (После полевых испытаний)";D2D2D2;710
310776613;0;4000;2;116;Ширпотреб;"Немного поношенное";3;Обыч.;"MP7 | Армейский спецназ (Немного поношенное)";D2D2D2;21
310776620;0;798;6;188;"Промышленное качество";"Немного поношенное";3;Обыч.;"P90 | Ясень (Немного поношенное)";D2D2D2;296
310776621;188530139;39300;7;169;Засекреченное;"После полевых испытаний";17;Обыч.;"AK-47 | Красный глянец (После полевых испытаний)";D2D2D2;868
310776622;188530139;7938;2;11;"Армейское качество";"После полевых испытаний";47;Обыч.;"SCAR-20 | Кровавая паутина (После полевых испытани";D2D2D2;373
310776629;188530139;9600;3;34;"Армейское качество";"Прямо с завода";19;Обыч.;"P250 | Улей (Прямо с завода)";D2D2D2;599
310776630;188530139;160058;5;71;Тайное;"Немного поношенное";47;Обыч.;"SSG 08 | Кровь в воде (Немного поношенное)";D2D2D2;1250
310776632;0;699;6;104;Ширпотреб;"Немного поношенное";47;Обыч.;"SCAR-20 | Наемник (Немного поношенное)";D2D2D2;119
310776635;188530139;3500;6;33;"Армейское качество";"Прямо с завода";19;Обыч.;"P250 | Ржавая сталь (Прямо с завода)";D2D2D2;468
310776642;0;1925;7;253;"Промышленное качество";"Немного поношенное";17;Обыч.;"M4A1-S | Северный лес (Немного поношенное)";D2D2D2;1075
310776645;188530139;8000;1;12;"Армейское качество";"Немного поношенное";47;Обыч.;"G3SG1 | Лазурная зебра (Немного поношенное)";D2D2D2;241
310776648;0;6000;1;11;Ширпотреб;"Немного поношенное";19;Обыч.;"Tec-9 | Смерч (Немного поношенное)";D2D2D2;697
310776650;0;3900;4;50;"Армейское качество";"Прямо с завода";49;Обыч.;"Sawed-Off | Янтарный градиент (Прямо с завода)";D2D2D2;233
310776654;188530139;17000;2;119;"Армейское качество";"Прямо с завода";17;Обыч.;"M4A1-S | Кровавый тигр (Прямо с завода)";D2D2D2;824
310776658;188530139;38899;3;264;Запрещенное;"Прямо с завода";19;Обыч.;"Glock-18 | Татуировка дракона (Прямо с завода)";D2D2D2;956
310776665;0;7275;3;24;Ширпотреб;"Прямо с завода";19;Обыч.;"Five-SeveN | Анодированный металл (Прямо с завода)";D2D2D2;1000
310776668;0;100;30;782;Ширпотреб;"После полевых испытаний";3;Обыч.;"MP7 | Армейский спецназ (После полевых испытаний)";D2D2D2;420
310776670;302028390;4558;2;73;"Армейское качество";"После полевых испытаний";49;Обыч.;"Sawed-Off | Янтарный градиент (После полевых испытаний)";D2D2D2;104
310776672;0;100;327;252;Ширпотреб;"После полевых испытаний";47;Обыч.;"SCAR-20 | Песчаная сетка (После полевых испытаний)";D2D2D2;770
310776675;188530144;5400;26;0;"Армейское качество";"Прямо с завода";17;StatTrak™;"StatTrak™ Galil AR | Синий титан (Прямо с завода)";CF6A32;1000
310776676;0;5500;3;1;Ширпотреб;"Закаленное в боях";75;Обыч.;"M249 | Пиксельный камуфляж «Джунгли» (Закаленное в";D2D2D2;394
310776681;0;7000;2;1;Ширпотреб;"Закаленное в боях";49;Обыч.;"XM1014 | Джунгли (Закаленное в боях)";D2D2D2;225
310776687;188530139;3500;4;18;"Армейское качество";"Немного поношенное";19;Обыч.;"P250 | Ржавая сталь (Немного поношенное)";D2D2D2;429
310776691;302028390;100;5;72;Ширпотреб;"Немного поношенное";3;Обыч.;"ПП-19 Бизон | Песчаная штриховка (Немного поношенное)";D2D2D2;820
310776693;0;500;4;104;Ширпотреб;"Закаленное в боях";49;Обыч.;"Nova | Песчаные дюны (Закаленное в боях)";D2D2D2;156
310776701;0;4000;3;10;Ширпотреб;"После полевых испытаний";47;Обыч.;"SSG 08 | Лишайниковая штриховка (После полевых исп";D2D2D2;186
310776706;0;7000;1;3;Ширпотреб;"После полевых испытаний";17;Обыч.;"SG 553 | Смерч (После полевых испытаний)";D2D2D2;986
310776710;0;2600;3;2;Ширпотреб;Поношенное;3;Обыч.;"ПП-19 Бизон | Лесные листья (Поношенное)";D2D2D2;419
310776711;0;265;6;91;"Промышленное качество";"Прямо с завода";49;Обыч.;"MAG-7 | Пиксельный камуфляж «Металлический» (Прямо";D2D2D2;755
310776711;302028390;260;6;217;"Промышленное качество";"Прямо с завода";49;Обыч.;"MAG-7 | Пиксельный камуфляж «Металлический» (Прямо с завода)";D2D2D2;988
310776714;0;2197;7;12;Ширпотреб;"После полевых испытаний";17;Обыч.;"Galil AR | Охотничья будка (После полевых испытани";D2D2D2;189
310776717;0;141;21;77;Ширпотреб;"После полевых испытаний";47;Обыч.;"G3SG1 | Полярный камуфляж (После полевых испытаний";D2D2D2;589
310776717;302028390;100;48;552;Ширпотреб;"После полевых испытаний";47;Обыч.;"G3SG1 | Полярный камуфляж (После полевых испытаний)";D2D2D2;700
310776718;0;265;13;318;"Промышленное качество";"Немного поношенное";3;Обыч.;"MAC-10 | Карамельное яблоко (Немного поношенное)";D2D2D2;347
310776726;0;957;44;1741;"Промышленное качество";"После полевых испытаний";17;Обыч.;"M4A1-S | Северный лес (После полевых испытаний)";D2D2D2;665
310776730;188530139;17092;5;117;Запрещенное;"После полевых испытаний";19;Обыч.;"Five-SeveN | Поверхностная закалка (После полевых ";D2D2D2;1298
310776735;0;3000;3;87;"Армейское качество";"Прямо с завода";19;Обыч.;"Desert Eagle | Городской щебень (Прямо с завода)";D2D2D2;233
310776737;0;4998;5;792;"Армейское качество";"Прямо с завода";47;Обыч.;"SSG 08 | Кислотный градиент (Прямо с завода)";D2D2D2;667
310776743;188530139;11000;2;19;Запрещенное;"Немного поношенное";19;Обыч.;"Dual Berettas | Гемоглобин (Немного поношенное)";D2D2D2;570
310776745;188530139;9900;4;145;Запрещенное;"Немного поношенное";17;Обыч.;"FAMAS | Пульс (Немного поношенное)";D2D2D2;808
310776747;0;3085;1;3;Ширпотреб;"Немного поношенное";3;Обыч.;"MP7 | Грунтовая вода (Немного поношенное)";D2D2D2;779
310776749;188530139;19900;3;50;Запрещенное;"Немного поношенное";19;Обыч.;"P250 | Пятно (Немного поношенное)";D2D2D2;1037
310776751;188530139;4497;7;23;"Армейское качество";"Прямо с завода";47;Обыч.;"G3SG1 | Лазурная зебра (Прямо с завода)";D2D2D2;482
310776753;188530139;2200;47;206;"Армейское качество";"Прямо с завода";17;Обыч.;"Galil AR | Синий титан (Прямо с завода)";D2D2D2;744
310776755;188530139;10156;3;200;Запрещенное;"После полевых испытаний";17;Обыч.;"AK-47 | Синий ламинат (После полевых испытаний)";D2D2D2;716
310776765;0;100;12;70;Ширпотреб;"После полевых испытаний";3;Обыч.;"ПП-19 Бизон | Городская штриховка (После полевых и";D2D2D2;710
310776765;302028390;100;196;637;Ширпотреб;"После полевых испытаний";3;Обыч.;"ПП-19 Бизон | Городская штриховка (После полевых испытаний)";D2D2D2;720
310776767;0;269;11;321;"Промышленное качество";"Прямо с завода";47;Обыч.;"SCAR-20 | Углепластик (Прямо с завода)";D2D2D2;1007
310776773;0;343;92;851;"Промышленное качество";"После полевых испытаний";17;Обыч.;"AUG | Осужденный (После полевых испытаний)";D2D2D2;662
310776778;0;177;4;115;Ширпотреб;"Немного поношенное";49;Обыч.;"Nova | Песчаные дюны (Немного поношенное)";D2D2D2;158
310776780;0;4025;2;3;"Промышленное качество";"После полевых испытаний";75;Обыч.;"Negev | Пальма (После полевых испытаний)";D2D2D2;904
310776784;0;100;78;1238;Ширпотреб;"После полевых испытаний";19;Обыч.;"Five-SeveN | Лесная ночь (После полевых испытаний)";D2D2D2;770
310776787;0;2134;4;4;Ширпотреб;"После полевых испытаний";49;Обыч.;"MAG-7 | Песчаные дюны (После полевых испытаний)";D2D2D2;272
310776790;188530139;249998;2;30;Засекреченное;"Немного поношенное";17;Обыч.;"AK-47 | Поверхностная закалка (Немного поношенное)";D2D2D2;925
310776798;0;5300;7;5;"Промышленное качество";"Закаленное в боях";17;Обыч.;"M4A4 | Смерч (Закаленное в боях)";D2D2D2;465
310776804;0;2996;3;19;"Армейское качество";"После полевых испытаний";19;Обыч.;"Desert Eagle | Городской щебень (После полевых исп";D2D2D2;164
310776804;302028390;2424;6;144;"Армейское качество";"После полевых испытаний";19;Обыч.;"Desert Eagle | Городской щебень (После полевых испытаний)";D2D2D2;228
310776810;188530139;55500;4;313;Засекреченное;"Прямо с завода";19;Обыч.;"Desert Eagle | Гипнотический (Прямо с завода)";D2D2D2;696
310776816;0;5899;1;7;"Промышленное качество";"После полевых испытаний";47;Обыч.;"SSG 08 | Тропическая гроза (После полевых испытани";D2D2D2;478
310776817;0;4800;4;320;"Армейское качество";"Прямо с завода";19;Обыч.;"Glock-18 | Карамельное яблоко (Прямо с завода)";D2D2D2;739
310776824;0;2198;4;36;Ширпотреб;"После полевых испытаний";19;Обыч.;"Five-SeveN | Наемник (После полевых испытаний)";D2D2D2;283
310776825;0;100;76;1427;Ширпотреб;"После полевых испытаний";19;Обыч.;"Dual Berettas | Наемник (После полевых испытаний)";D2D2D2;730
310776826;0;3026;2;118;Запрещенное;"После полевых испытаний";19;Обыч.;"P2000 | Янтарный градиент (После полевых испытаний";D2D2D2;730
310776826;302028390;2785;6;126;Запрещенное;"После полевых испытаний";19;Обыч.;"P2000 | Янтарный градиент (После полевых испытаний)";D2D2D2;873
310776829;188530139;17270;4;25;Запрещенное;"После полевых испытаний";17;Обыч.;"Galil AR | Пиксельный камуфляж «Ржавчина» (После п";D2D2D2;785
310776834;0;5000;1;4;Ширпотреб;"После полевых испытаний";3;Обыч.;"MP7 | Грунтовая вода (После полевых испытаний)";D2D2D2;218
310776837;0;2400;5;2;Ширпотреб;"После полевых испытаний";49;Обыч.;"XM1014 | Джунгли (После полевых испытаний)";D2D2D2;413
310776840;0;100;82;596;Ширпотреб;"После полевых испытаний";47;Обыч.;"SCAR-20 | Наемник (После полевых испытаний)";D2D2D2;570
310776843;188530139;10175;2;74;Запрещенное;"Немного поношенное";3;Обыч.;"MP9 | Железная роза (Немного поношенное)";D2D2D2;849
310776847;188530139;48150;2;126;Запрещенное;"Немного поношенное";19;Обыч.;"USP-S | Темная вода (Немного поношенное)";D2D2D2;660
310776853;0;5000;1;100;"Армейское качество";"Немного поношенное";17;Обыч.;"FAMAS | Демонтаж (Немного поношенное)";D2D2D2;320
310776856;0;5000;1;2;Ширпотреб;"Немного поношенное";49;Обыч.;"Sawed-Off | Радиоактивная опасность (Немного понош";D2D2D2;571
310776859;0;400;12;159;Ширпотреб;"Закаленное в боях";47;Обыч.;"SSG 08 | Голубая хвоя (Закаленное в боях)";D2D2D2;200
310776866;0;223;6;79;Ширпотреб;"Немного поношенное";17;Обыч.;"AUG | Гроза (Немного поношенное)";D2D2D2;413
310776869;0;2190;1;15;Ширпотреб;"После полевых испытаний";3;Обыч.;"ПП-19 Бизон | Радиоактивная опасность (После полев";D2D2D2;434
310776871;188530170;5094;10;11;"Армейское качество";"Немного поношенное";17;StatTrak™;"StatTrak™ Galil AR | Песчаная буря (Немного поноше";CF6A32;1009
310776874;0;6000;2;2;Ширпотреб;"Закаленное в боях";3;Обыч.;"MP9 | Сезон засухи (Закаленное в боях)";D2D2D2;497
310776880;0;720;86;488;"Промышленное качество";"После полевых испытаний";3;Обыч.;"MP9 | Апельсиновая корка (После полевых испытаний)";D2D2D2;139
310776881;0;2500;1;8;Ширпотреб;"После полевых испытаний";49;Обыч.;"Nova | Лесные листья (После полевых испытаний)";D2D2D2;298
310776883;188530139;5015;4;15;"Армейское качество";"После полевых испытаний";19;Обыч.;"Five-SeveN | Ками (После полевых испытаний)";D2D2D2;446
310776887;0;100;10;70;Ширпотреб;"Закаленное в боях";19;Обыч.;"P250 | Северный лес (Закаленное в боях)";D2D2D2;850
310776888;188530144;9000;2;7;"Армейское качество";"После полевых испытаний";3;StatTrak™;"StatTrak™ ПП-19 Бизон | Знак воды (После полевых и";CF6A32;616
310776893;188530170;12038;1;2;"Армейское качество";"После полевых испытаний";49;StatTrak™;"StatTrak™ MAG-7 | Объемные шестиугольники (После п";CF6A32;723
310776895;0;5999;2;0;Ширпотреб;Поношенное;75;Обыч.;"M249 | Пиксельный камуфляж «Джунгли» (Поношенное)";D2D2D2;183
310776896;0;7500;1;3;Ширпотреб;"Немного поношенное";75;Обыч.;"M249 | Пиксельный камуфляж «Джунгли» (Немного поно";D2D2D2;298
310776903;0;2025;5;5;Ширпотреб;"Немного поношенное";49;Обыч.;"Nova | Грецкий орех (Немного поношенное)";D2D2D2;1032
